{
    "$schema": "schema/pretrain_schema.json",
    "encoder_path": "params/original/encoder_bpe_40000.json",
    "bpe_path": "params/original/vocab_40000.bpe",
    "seed": 42,
    "n_iter": 1,
    "scores_per_epoch": 3,
    "test_split": 0.2,
    "validation_split": 0.2,
    "batch_size": 32,
    "n_embd": 768,
    "n_head": 12,
    "n_layer": 12,
    "embd_pdrop": 0.0,
    "attn_pdrop": 0.0,
    "resid_pdrop": 0.0,
    "lr": 6.25e-5,
    "b1": 0.9,
    "b2": 0.999,
    "eps": 1e-8,
    "max_sequence_dim": 16
}
